{
  "$schema": "https://json-schema.org/draft/2020-12/schema",
  "$id": "urn:agent-fabric:routing:profiles",
  "title": "Per-role and per-agent model profile layers for the OpenRouter launch path",
  "description": "Committed at routing/profiles.json. The class -> model mapping lives in routing/capabilities.json; this file carries the layers that override it for one role or one agent, plus the session model — per provider, because the two launch paths speak different vocabularies (an OpenRouter id on the broker; a native claude-… id on plain claude). The vocabulary is the capability class (code-low, code-medium, code-high, code-plan, code-review) and the provider's model id; a harness tier alias is never named here — which alias a class rides is runtime/claude-code/aliases.json's, internal to the adapter. Resolution is a per-provider, per-key merge, nearest layer wins: capabilities.providers.<provider>.models <- defaults <- roles.<role> <- agents.<login> <- the agent's gitignored model-profile.local.json (written by bin/fabric-model). The launcher exports each class for the tier it rides (the broker: with its family shim); the review class reaches the reviewer's agent file instead, on both paths. The review capability's merged model must be in routing/policies/review-grade.json on every provider. Credentials are never here. Authored by architect-cto like a charter.",
  "type": "object",
  "required": [
    "version",
    "defaults"
  ],
  "additionalProperties": false,
  "$defs": {
    "model_id": {
      "description": "A canonical model reference: `vendor/model`, a dated `vendor/model-YYYYMMDD`, a family alias `~vendor/family-latest`, or a router `openrouter/<router>`; an optional `:variant` suffix (floor, nitro, exacto) and an optional `[1m]` context hint. A preset is a SHIM, not a model, so `@preset/...` is not a model id here; the runtime attaches it.",
      "type": "string",
      "pattern": "^~?[a-z0-9-]+/[a-z0-9.-]+(:[a-z]+)?(\\[1m\\])?$"
    },
    "profile": {
      "description": "One layer of the merge. Every field is optional in a layer.",
      "type": "object",
      "additionalProperties": false,
      "properties": {
        "session": {
          "description": "The OpenRouter form of the session: what `ori claude --model` receives (with its family shim) unless an explicit --model is given — an OpenRouter id, or a class. An `anthropic/<id>` (or a class) here also serves plain claude unless providers.anthropic.session says otherwise.",
          "oneOf": [
            {
              "$ref": "#/$defs/model_id"
            },
            {
              "$ref": "#/$defs/capability"
            }
          ]
        },
        "capabilities": {
          "$ref": "#/$defs/openrouter_capabilities"
        },
        "providers": {
          "description": "Per-provider choices for this layer; the vocabulary differs per provider, so each has its own shape. openai is the Codex review engine's (agent-fabric ADR-053): no session, code-review only.",
          "type": "object",
          "additionalProperties": false,
          "properties": {
            "openrouter": {
              "$ref": "#/$defs/openrouter_layer"
            },
            "anthropic": {
              "$ref": "#/$defs/anthropic_layer"
            },
            "openai": {
              "$ref": "#/$defs/openai_layer"
            }
          }
        },
        "launch_provider": {
          "description": "The provider fabric-resume launches on when it is given none. The agent's own layer is the declared choice and outranks the account's last launch (launch-provider.json), which only remembers; the role's and the defaults' layers apply only to an account with no launch on record (a first activation from Fleet Deck). An explicit --provider always wins on a launch; a restart (fabric-ctl restart, an upgrade) replays the original arguments with the agent layer's declaration in place of their --provider. The launcher run directly keeps its own default. An agent layer of \"anthropic\" over a last launch that went through the gateway still comes back through it (the declaration names the column, the record's transport how it is reached). \"gateway\" is the anthropic column reached through agent-fabric-gateway (tools/fabric/launcher/gateway.py), not a routing column of its own.",
          "enum": [
            "anthropic",
            "gateway",
            "openrouter"
          ]
        },
        "notes": {
          "description": "Why this layer differs from the one below it — one or two sentences, for the reader of the file.",
          "type": "string"
        }
      }
    },
    "native_id": {
      "description": "A native Claude id as plain `claude` names it (claude-opus-5, claude-sonnet-5[1m]); what a tier alias binds to when the fabric pins it.",
      "type": "string",
      "pattern": "^claude-[a-z0-9.-]+(\\[1m\\])?$"
    },
    "openrouter_layer": {
      "description": "The broker path's choices for this layer: the session (an OpenRouter id, or a class) and any class, as OpenRouter ids. The same as the flat `session`/`capabilities`, spelled under its provider.",
      "type": "object",
      "additionalProperties": false,
      "properties": {
        "session": {
          "oneOf": [
            {
              "$ref": "#/$defs/model_id"
            },
            {
              "$ref": "#/$defs/capability"
            }
          ]
        },
        "capabilities": {
          "$ref": "#/$defs/openrouter_capabilities"
        }
      }
    },
    "openrouter_capabilities": {
      "description": "Overrides of the class -> OpenRouter model mapping for this layer.",
      "type": "object",
      "additionalProperties": false,
      "properties": {
        "code-low": {
          "$ref": "#/$defs/model_id"
        },
        "code-medium": {
          "$ref": "#/$defs/model_id"
        },
        "code-high": {
          "$ref": "#/$defs/model_id"
        },
        "code-plan": {
          "$ref": "#/$defs/model_id"
        },
        "code-review": {
          "description": "The merged value MUST be one of routing/policies/review-grade.json; lint and the launcher both refuse otherwise.",
          "$ref": "#/$defs/model_id"
        }
      }
    },
    "anthropic_layer": {
      "description": "Plain claude's choices for this layer: the session (a native Claude id, or a class) and any class, as native Claude ids. A coding class's pin is exported for the tier it rides (ANTHROPIC_DEFAULT_*_MODEL, session-wide); code-review's reaches the reviewer's agent file and MUST be review-grade.",
      "type": "object",
      "additionalProperties": false,
      "properties": {
        "session": {
          "oneOf": [
            {
              "$ref": "#/$defs/native_id"
            },
            {
              "$ref": "#/$defs/capability"
            }
          ]
        },
        "capabilities": {
          "type": "object",
          "additionalProperties": false,
          "properties": {
            "code-low": {
              "$ref": "#/$defs/native_id"
            },
            "code-medium": {
              "$ref": "#/$defs/native_id"
            },
            "code-high": {
              "$ref": "#/$defs/native_id"
            },
            "code-plan": {
              "$ref": "#/$defs/native_id"
            },
            "code-review": {
              "$ref": "#/$defs/native_id"
            }
          }
        }
      }
    },
    "openai_id": {
      "description": "An OpenAI model id as Codex names it, bare (gpt-6.1-sol); routing/policies/review-grade.json admits it as openai/<id>.",
      "type": "string",
      "pattern": "^(gpt|o[0-9]|codex)[a-z0-9.-]*$"
    },
    "openai_layer": {
      "description": "The Codex review engine's choices for this layer (routing/capabilities.json providers.openai): the code-review model as a bare Codex id, and its effort level. No session — the engine launches none — and no coding class: the engine runs the review alone. The merged model MUST be review-grade.",
      "type": "object",
      "additionalProperties": false,
      "properties": {
        "capabilities": {
          "type": "object",
          "additionalProperties": false,
          "properties": {
            "code-review": {
              "$ref": "#/$defs/openai_id"
            }
          }
        },
        "effort": {
          "description": "The level, in routing/effort.json's vocabulary; Codex takes none..xhigh.",
          "type": "object",
          "additionalProperties": false,
          "properties": {
            "code-review": {
              "enum": [
                "none",
                "minimal",
                "low",
                "medium",
                "high",
                "xhigh"
              ]
            }
          }
        }
      }
    },
    "capability": {
      "description": "A capability class, meaning that class's model on the provider.",
      "enum": [
        "code-low",
        "code-medium",
        "code-high",
        "code-plan",
        "code-review"
      ]
    }
  },
  "properties": {
    "version": {
      "type": "integer",
      "const": 2
    },
    "description": {
      "type": "string"
    },
    "defaults": {
      "description": "The bottom layer above capabilities.json. Must yield a session for every provider (lint checks the merge, since the flat `session` may serve both).",
      "$ref": "#/$defs/profile"
    },
    "roles": {
      "description": "Per-role layer, keyed by a role id from identities/roles/catalog.json.",
      "type": "object",
      "additionalProperties": false,
      "patternProperties": {
        "^[a-z][a-z0-9-]*$": {
          "$ref": "#/$defs/profile"
        }
      }
    },
    "agents": {
      "description": "Per-agent layer, keyed by the agent's Linux login (runtime/identity.py). Never a directory or clone name.",
      "type": "object",
      "additionalProperties": false,
      "patternProperties": {
        "^[a-z_][a-z0-9_-]*$": {
          "$ref": "#/$defs/profile"
        }
      }
    }
  }
}
